{
  "$schema": "https://json-schema.org/draft/2020-12/schema",
  "$id": "https://purchase-research-agent.local/contracts/collector/v1-abcmart/abcmart-crawl-item.schema.json",
  "title": "ABC마트 크롤러 상품 항목 v1-abcmart",
  "description": "purchase-research-agent의 AbcMartCrawler(app/crawlers/abcmart/crawler.py)가 반환하는 상품 dict 1건의 실제 모양을 정의한다. contracts/collector/v1의 collector-result.schema.json(Go Collector 전용, 아직 미구현)과는 별개이며, 지금 실제로 동작 중인 purchase-research-agent(FastAPI) → purchase-research-backend(Spring, MySQL) 파이프라인을 기준으로 만들었다. 자세한 배경은 README.md 참조.",
  "type": "object",
  "additionalProperties": false,
  "required": [
    "source_product_id",
    "title",
    "brand",
    "price",
    "price_original",
    "discount_percent",
    "image_url",
    "color",
    "style_code",
    "link",
    "site"
  ],
  "properties": {
    "site": {
      "const": "abcmart"
    },
    "source_product_id": {
      "type": "string",
      "minLength": 1,
      "maxLength": 50,
      "description": "DB product.source_product_id VARCHAR(50) NOT NULL. 빈 문자열이면 ProductPayload.sourceProductId @NotBlank에 걸린다."
    },
    "title": {
      "type": "string",
      "minLength": 1,
      "maxLength": 300,
      "description": "DB product.title VARCHAR(300) NOT NULL."
    },
    "brand": {
      "type": "string",
      "maxLength": 100,
      "description": "DB product.brand VARCHAR(100). 크롤러는 미발견 시 빈 문자열을 넣는다(null 아님)."
    },
    "price": {
      "$ref": "#/$defs/priceString"
    },
    "price_original": {
      "$ref": "#/$defs/priceString"
    },
    "discount_percent": {
      "type": ["integer", "null"],
      "minimum": 0,
      "maximum": 100
    },
    "image_url": {
      "type": "string",
      "maxLength": 500,
      "description": "DB product.image_url VARCHAR(500). 빈 문자열 가능."
    },
    "color": {
      "type": "string",
      "description": "목록 페이지에서 설정된 대표 색상. ProductPayload/DDL에는 별도 컬럼이 없고 CrawlTriggerService.toPayload()가 이 값을 실제로 썬지 않는다(없어지는 필드)."
    },
    "style_code": {
      "type": "string",
      "maxLength": 50,
      "description": "DB product.style_code VARCHAR(50)."
    },
    "link": {
      "type": "string",
      "minLength": 1,
      "maxLength": 500,
      "pattern": "^https://abcmart\\.a-rt\\.com/product\\?prdtNo=\\d+$|^https://www\\.abcmart\\.co\\.kr/.*$",
      "description": "DB product.link VARCHAR(500) NOT NULL. product.site + source_product_id가 UNIQUE KEY이므로 source_product_id가 link에서 추출된 값과 일치해야 한다."
    },
    "rating": {
      "type": ["number", "null"],
      "minimum": 0,
      "maximum": 5,
      "description": "attach_details() 시 reviews[].score 평균으로 계산. 리뷰 없으면 null."
    },
    "review_count": {
      "type": "integer",
      "minimum": 0,
      "description": "attach_details()로 상세를 붙인 상위 detail_limit개 상품에만 존재한다."
    },
    "reviews": {
      "type": "array",
      "items": { "$ref": "#/$defs/review" },
      "description": "attach_details()가 붙인 리뷰 목록."
    },
    "options": {
      "$ref": "#/$defs/options"
    },
    "images": {
      "type": "array",
      "items": { "type": "string", "maxLength": 500 },
      "description": "crawl4ai 상세 페이지 렌더링 후 메인 슬라이더 이미지(shrink=580:580) URL 목록."
    },
    "category": {
      "type": "string",
      "maxLength": 100,
      "description": "JS 내 category JSON에서 추출한 최소 카테고리명 (예: '웨지')."
    },
    "category_path": {
      "type": "string",
      "maxLength": 200,
      "description": "JS 내 category JSON 전체 경로 (예: '신발 > 구두 > 웨지')."
    },
    "in_stock": {
      "type": ["boolean", "null"],
      "description": "sold-out 클래스 없는 사이즈 버튼이 하나라도 있으면 true."
    }
  },
  "$defs": {
    "priceString": {
      "type": "string",
      "pattern": "^$|^[0-9,]+원$",
      "description": "빈 문자열 또는 '89,000원' 형태. CrawlTriggerService.parsePrice()가 숫자만 추출해 Integer로 변환한다."
    },
    "review": {
      "type": "object",
      "additionalProperties": false,
      "required": ["review_source_id", "content", "score", "date", "size"],
      "properties": {
        "review_source_id": {
          "type": ["string", "null"],
          "maxLength": 50,
          "description": "prdtRvwSeq. null이면 ReviewPayload.reviewSourceId @NotBlank에 위반."
        },
        "content": {
          "type": "string",
          "maxLength": 200
        },
        "score": {
          "type": ["number", "null"],
          "minimum": 0,
          "maximum": 5,
          "description": "productReviewEvlts 중 prdtRvwCode=10000(종합 만족도) evltScore. API가 정수로 반환."
        },
        "detail_scores": {
          "type": "object",
          "additionalProperties": { "type": "number" },
          "description": "항목별 세부 점수. 착화감/가격/디자인/내구성/경량성 등 상품에 따라 존재하는 항목이 다름."
        },
        "date": {
          "type": "string",
          "description": "writeDtm 앞 10자리(YYYY-MM-DD)."
        },
        "size": {
          "type": "string",
          "description": "optnName — 'BLACK, 240' 형태로 색상+사이즈가 합쳐져 반환되는 경우 있음."
        },
        "color": {
          "type": "string",
          "description": "prdtColorCodeName — 리뷰 작성 시 선택한 색상."
        },
        "helpful_count": {
          "type": "integer",
          "minimum": 0,
          "description": "helpfulCnt — 도움이 됐어요 수."
        },
        "is_best": {
          "type": "boolean",
          "description": "bestYn == 'Y'."
        },
        "images": {
          "type": "array",
          "items": { "type": "string", "maxLength": 500 },
          "description": "productReviewImages에서 추출한 리뷰 이미지 URL 목록."
        }
      }
    },
    "options": {
      "type": "object",
      "additionalProperties": false,
      "properties": {
        "colors": {
          "type": "array",
          "items": { "type": "string", "maxLength": 50 }
        },
        "sizes": {
          "type": "array",
          "items": { "type": "string", "maxLength": 50 }
        }
      },
      "description": "OptionsPayload(colors, sizes)와 필드명이 그대로 일치한다. DB product_option.option_value가 VARCHAR(50)이므로 각 항목도 50자 이하여야 한다."
    }
  }
}
